{
  "resourceType": "Patient",
  "id": "patient-009",
  "demographics": {
    "name": {
      "given": "Keiko",
      "family": "Tanaka"
    },
    "birthDate": "2001-12-05",
    "gender": "female",
    "phone": "312-555-0219",
    "email": "keiko.tanaka@rush.edu",
    "address": {
      "line": "1528 W Taylor St, Apt 4F",
      "city": "Chicago",
      "state": "IL",
      "postalCode": "60607"
    },
    "emergencyContact": {
      "name": "Yuki Tanaka",
      "relationship": "Mother",
      "phone": "847-555-0483"
    },
    "insurance": {
      "type": "Commercial",
      "planName": "UnitedHealthcare (parent's plan)",
      "memberId": "UHC-DP-6621847"
    },
    "preferredLanguage": "English"
  },
  "socialHistory": {
    "smoking": "Never smoker",
    "alcohol": "Social, 1-2 drinks on weekends",
    "exercise": "Runs 3x/week, intramural volleyball",
    "notes": "Nursing student (BSN program, junior year). Lives with two roommates near campus. Originally from Skokie, IL. Parents are both in the area. Busy with clinicals and studying."
  },
  "familyHistory": [
    {
      "relationship": "Father",
      "condition": "Healthy, age 56",
      "deceased": false
    },
    {
      "relationship": "Mother",
      "condition": "Migraines",
      "deceased": false
    },
    {
      "relationship": "Paternal grandfather",
      "condition": "Colon cancer, diagnosed at 68",
      "deceased": true
    }
  ],
  "allergies": [
    {
      "substance": "Tree pollen",
      "category": "environment",
      "reaction": "Rhinitis, watery eyes",
      "criticality": "low",
      "status": "active"
    },
    {
      "substance": "Dust mites",
      "category": "environment",
      "reaction": "Sneezing, congestion",
      "criticality": "low",
      "status": "active"
    }
  ],
  "conditions": [
    {
      "code": {
        "system": "ICD-10",
        "code": "J30.1",
        "display": "Allergic rhinitis due to pollen"
      },
      "status": "active",
      "onsetDate": "2018-05-10",
      "notes": "Seasonal allergic rhinitis. Symptoms primarily in spring and fall. Well-controlled with cetirizine PRN."
    },
    {
      "code": {
        "system": "ICD-10",
        "code": "N30.00",
        "display": "Acute cystitis without hematuria"
      },
      "status": "resolved",
      "onsetDate": "2025-09-18",
      "resolvedDate": "2025-09-25",
      "notes": "Uncomplicated UTI. Treated with nitrofurantoin 100mg BID x5 days. Symptoms resolved completely."
    }
  ],
  "medications": [
    {
      "code": {
        "system": "RxNorm",
        "code": "1014676",
        "display": "Cetirizine Hydrochloride 10 MG Oral Tablet"
      },
      "dosage": "10 mg",
      "frequency": "Once daily as needed for allergy symptoms",
      "route": "oral",
      "status": "active",
      "prescribedDate": "2023-06-15",
      "prescriber": "Dr. Sarah Kim, MD"
    },
    {
      "code": {
        "system": "RxNorm",
        "code": "311989",
        "display": "Nitrofurantoin 100 MG Modified Release Oral Capsule"
      },
      "dosage": "100 mg",
      "frequency": "Twice daily",
      "route": "oral",
      "status": "completed",
      "prescribedDate": "2025-09-18",
      "endDate": "2025-09-23",
      "prescriber": "Rachel Torres, NP",
      "stopReason": "Course completed — UTI resolved"
    }
  ],
  "immunizations": [
    {
      "code": {
        "system": "CVX",
        "code": "43",
        "display": "Hepatitis B vaccine, adult dosage"
      },
      "date": "2023-06-15",
      "site": "Left deltoid",
      "lotNumber": "HBV2341A",
      "provider": "Dr. Sarah Kim, MD"
    },
    {
      "code": {
        "system": "CVX",
        "code": "43",
        "display": "Hepatitis B vaccine, adult dosage"
      },
      "date": "2023-07-15",
      "site": "Left deltoid",
      "lotNumber": "HBV2341A",
      "provider": "Rachel Torres, NP"
    },
    {
      "code": {
        "system": "CVX",
        "code": "43",
        "display": "Hepatitis B vaccine, adult dosage"
      },
      "date": "2023-12-15",
      "site": "Left deltoid",
      "lotNumber": "HBV2398C",
      "provider": "Dr. Sarah Kim, MD"
    },
    {
      "code": {
        "system": "CVX",
        "code": "03",
        "display": "MMR vaccine"
      },
      "date": "2023-06-15",
      "site": "Right deltoid",
      "lotNumber": "MMR7821K",
      "provider": "Dr. Sarah Kim, MD"
    },
    {
      "code": {
        "system": "CVX",
        "code": "21",
        "display": "Varicella vaccine"
      },
      "date": "2023-06-15",
      "site": "Left upper arm (subcutaneous)",
      "lotNumber": "VAR5517B",
      "provider": "Dr. Sarah Kim, MD"
    },
    {
      "code": {
        "system": "CVX",
        "code": "115",
        "display": "Tdap vaccine"
      },
      "date": "2023-06-15",
      "site": "Right deltoid",
      "lotNumber": "TD4428P",
      "provider": "Dr. Sarah Kim, MD"
    },
    {
      "code": {
        "system": "CVX",
        "code": "197",
        "display": "Influenza vaccine, quadrivalent, adjuvanted"
      },
      "date": "2023-10-02",
      "site": "Left deltoid",
      "lotNumber": "FL3382N",
      "provider": "Rachel Torres, NP"
    },
    {
      "code": {
        "system": "CVX",
        "code": "197",
        "display": "Influenza vaccine, quadrivalent, adjuvanted"
      },
      "date": "2024-09-27",
      "site": "Left deltoid",
      "lotNumber": "FL4491R",
      "provider": "Dr. Sarah Kim, MD"
    },
    {
      "code": {
        "system": "CVX",
        "code": "197",
        "display": "Influenza vaccine, quadrivalent, adjuvanted"
      },
      "date": "2025-10-06",
      "site": "Left deltoid",
      "lotNumber": "FL5518T",
      "provider": "Rachel Torres, NP"
    },
    {
      "code": {
        "system": "CVX",
        "code": "213",
        "display": "SARS-COV-2 (COVID-19) vaccine, mRNA, spike protein, LNP, preservative free, 30 mcg/0.3mL dose"
      },
      "date": "2023-10-02",
      "site": "Right deltoid",
      "lotNumber": "CV8834A",
      "provider": "Rachel Torres, NP"
    },
    {
      "code": {
        "system": "CVX",
        "code": "213",
        "display": "SARS-COV-2 (COVID-19) vaccine, mRNA, spike protein, LNP, preservative free, 30 mcg/0.3mL dose"
      },
      "date": "2024-09-27",
      "site": "Right deltoid",
      "lotNumber": "CV9102F",
      "provider": "Dr. Sarah Kim, MD"
    },
    {
      "code": {
        "system": "CVX",
        "code": "213",
        "display": "SARS-COV-2 (COVID-19) vaccine, mRNA, spike protein, LNP, preservative free, 30 mcg/0.3mL dose"
      },
      "date": "2025-10-06",
      "site": "Right deltoid",
      "lotNumber": "CV0247K",
      "provider": "Rachel Torres, NP"
    }
  ],
  "encounters": [
    {
      "id": "enc-009-001",
      "date": "2023-06-15",
      "type": "annual-physical",
      "provider": "Dr. Sarah Kim, MD",
      "reasonForVisit": "Annual physical exam / establish care; immunization catch-up for nursing clinicals",
      "vitals": {
        "bloodPressure": {
          "systolic": 108,
          "diastolic": 68,
          "unit": "mmHg"
        },
        "heartRate": {
          "value": 56,
          "unit": "bpm"
        },
        "temperature": {
          "value": 98.2,
          "unit": "°F"
        },
        "weight": {
          "value": 128,
          "unit": "lbs"
        },
        "height": {
          "value": 64,
          "unit": "in"
        },
        "bmi": 22.0,
        "respiratoryRate": {
          "value": 14,
          "unit": "breaths/min"
        },
        "oxygenSaturation": {
          "value": 99,
          "unit": "%"
        }
      },
      "notes": {
        "subjective": "21-year-old female presenting to establish care. Starting BSN program at Rush and needs immunization clearance for clinicals. Reports seasonal allergies managed with OTC cetirizine as needed — primarily spring and fall symptoms (rhinorrhea, watery eyes, sneezing). No other complaints. Runs 3x/week and plays intramural volleyball. Feels well overall.",
        "objective": "Well-appearing young woman in no acute distress. HEENT: TMs clear, oropharynx normal, no nasal polyps, mild clear rhinorrhea. Lungs: clear bilaterally. Heart: regular rate and rhythm, no murmurs. Abdomen: soft, non-tender. Skin: no concerning lesions. Musculoskeletal: full ROM all extremities.",
        "assessment": "Healthy 21-year-old female establishing care. Allergic rhinitis (J30.1), well-controlled with PRN cetirizine. Needs immunization series for nursing clinical requirements.",
        "plan": "1. Prescribed cetirizine 10mg PRN for allergies. 2. Administered Hep B dose #1, MMR booster, varicella booster, and Tdap today. 3. Hep B dose #2 in 1 month, dose #3 at 6 months. 4. Flu and COVID vaccines due in fall. 5. Routine labs: CBC, CMP. 6. Return in 1 month for Hep B #2, then annual."
      },
      "labOrders": ["lab-009-001"]
    },
    {
      "id": "enc-009-002",
      "date": "2024-09-27",
      "type": "annual-physical",
      "provider": "Dr. Sarah Kim, MD",
      "reasonForVisit": "Annual physical exam; flu and COVID vaccines",
      "vitals": {
        "bloodPressure": {
          "systolic": 110,
          "diastolic": 70,
          "unit": "mmHg"
        },
        "heartRate": {
          "value": 54,
          "unit": "bpm"
        },
        "temperature": {
          "value": 98.4,
          "unit": "°F"
        },
        "weight": {
          "value": 130,
          "unit": "lbs"
        },
        "height": {
          "value": 64,
          "unit": "in"
        },
        "bmi": 22.3,
        "respiratoryRate": {
          "value": 14,
          "unit": "breaths/min"
        },
        "oxygenSaturation": {
          "value": 99,
          "unit": "%"
        }
      },
      "notes": {